"id";"title";"year";"depth";"citingFilled";"geosimvalid"
"14399734490457975000";" Spatial sensitivity analysis: an application of HARVEST to a Spectrum alternative";"2005";"2";"false";"716"
"2518827620957380169";"A review of assessment methods for cellular automata models of land-use change and urban growth";"2020";"2";"false";"521"
"15194021223905389657";"Modelling global urban land-use change process using spherical cellular automata";"2023";"2";"false";"721"
"11594980927348266619";"Spatial aspects of movement of Olomouc and Ostrava citizens";"2016";"2";"false";"834"
"1497457778352568205";"Combining system dynamics model, GIS and 3D visualization in sustainability assessment of urban residential development";"2012";"2";"false";"707"
"2716087680094238143";"A spatial simulation experiment to replicate fluvial sediment fluxes within the Magdalena River Basin, Colombia";"2010";"2";"false";"166"
"8635541267285341369";" A multi-scale urban integrated assessment framework for climate change studies: A flooding application";"2019";"2";"false";"579"
"7047694228958687918";"Landscape modeling for forest restoration planning and assessment: Lessons from the southern Appalachian Mountains";"2008";"2";"false";"710"
"5032823646593959795";" Non-ergodic probabilistic seismic hazard analysis and spatial simulation of variation in ground motion";"2009";"2";"false";"237"
"386687793074630027";"Virtual sorghum: visualisation of partitioning and morphogenesis";"2000";"2";"false";"817"
"3400967351317956000";"Scale and adequacy of environmental microsimulation";"2009";"2";"false";"768"
"4392849151774651983";"Impact of Herbivore-induced Plant Volatiles on Parasitoid Foraging Success: A Spatial Simulation of the Cotesia rubecula, Pieris rapae, and Brassica oleracea …";"2008";"2";"false";"372"
"6172397463605125464";"Resilience assessment and planning of suburban rural settlements based on complex network";"2021";"2";"false";"18"
"2630547870001252637";"A multi-agent architecture for geosimulation of moving agents";"2015";"2";"false";"233"
"10074581613819616729";"Sensor Network and GeoSimulation: Keystones for Spatial Decision Support Systems";"2011";"2";"false";"290"
"2628593382298768585";" How do land use policies influence fragmentation? An econometric model of land development with spatial simulation";"2012";"2";"false";"308"
"12138956568197931491";" Global land projection based on plant functional types with a 1-km resolution under socio-climatic scenarios";"2022";"2";"false";"475"
"6292148787891960297";"Hemodynamic effects of the geometric dimensions of graft vessels in coronary artery bypass graft models";"1998";"2";"false";"700"
"3235711479926487050";" Geomatic-based flood loss assessment and its application in an eastern city of China";"2022";"2";"false";"453"
"13065689606144736776";"A geosimulation approach for data scarce environments: modeling dynamics of forest insect infestation across different landscapes";"2016";"2";"false";"78"
"12900440254102925829";"Linking temporal-optimization and spatial-simulation models for forest planning";"2003";"2";"false";"334"
"14305991567246691184";" The emergency response and its impacts assessment in Western China";"NA";"2";"false";"632"
"8552735999677501988";"Assessment of sustainable urban development based on a hybrid decision-making approach: Group fuzzy BWM, AHP, and TOPSIS–GIS";"2022";"2";"false";"803"
"2433520053401311418";"Geospatial Data Mining, Computer Vision-based Lane Detection and Object Localization Algorithms, and Mapping and Navigation Tools in Smart Urban Mobility …";"2022";"2";"false";"691"
"10730889935234835827";"Urban form, daily travel behaviour and transport CO2 emission: Micro-level analysis and spatial simulation";"2014";"2";"false";"260"
"10561006600316655399";" Optimising the application of multiple-capture traps for invasive species management using spatial simulation";"2015";"2";"false";"340"
"12999332796082677333";"Forest Landscape Response to Different Harvest Scenarios under Climate Warming–A Spatial Simulation Study";"2002";"2";"false";"389"
"14080150840942496764";"SUBSTANTIATION OF PROJECT PARAMETERS OF HYDRAULIC UNITS OF HIGH-HEAD TURBINES";"2015";"2";"false";"536"
"7495679672377912521";"Simulating soil erodibility in southeastern China using a sequential Gaussian algorithm";"2021";"2";"false";"760"
"4506849478949364058";" Simulation of citrus production space based on MaxEnt";"2022";"2";"false";"675"
"15433106434269775702";"Spatial Structure: Theory, estimation and application in stock assessment models";"2020";"2";"false";"247"
"10709854658453121475";"GIS-based method for detecting high-crash-risk road segments using network kernel density estimation";"2013";"2";"false";"447"
"8316466945168230327";" Why the term prediction is overused";"2023";"2";"false";"819"
"1034583683085350095";"Exploring the acceptability of spatial simulation models of outdoor recreation for use by participants in public participation processes";"2010";"2";"false";"352"
"659173739384597200";"Life cycle assessment of plastic waste end-of-life for India and Indonesia";"2021";"2";"false";"757"
"484449275619757505";"Uncertainty assessment of soil erodibility factor for revised universal soil loss equation";"2001";"2";"false";"627"
"11686490908483946475";"Applicability comparison of various precipitation products of long-term hydrological simulations and their impact on parameter sensitivity";"2023";"2";"false";"781"
"12415481311367634830";"Evaluation of pattern scale stress effects of 28nm technology during wire bond and Cu pillar flip chip assembly";"2015";"2";"false";"544"
"2195834709006774785";" Assessment of land use land cover changes in Loktak Lake in Indo-Burma Biodiversity Hotspot using geospatial techniques";"2019";"2";"false";"459"
"18420980069763466677";"Integral assessment and spatial modeling of water areas pollution in the GIS technology";"2016";"2";"false";"302"
"16252113730088592147";" Drought induced death of bladder saltbush (Atriplex vesicaria) in the north east pastoral district of South Australia";"2012";"2";"false";"431"
"10615301742651724271";" Evaluating an alternative approach to seasonal monitoring for western New South Wales";"2001";"2";"false";"730"
"1612625247396652504";"Spatial simulation of the effect of fire and harvest on aboveground tree biomass in boreal forests of Northeast China";"2014";"2";"false";"188"
"16420004134285220210";" A Formalization of Spatial Spread";"NA";"2";"false";"840"
"9364060684207308197";"Spatial model error analysis using autocorrelation indices";"1995";"2";"false";"474"
"9613696668414082031";" A decision support system for wetland development";"NA";"2";"false";"778"
"1488954300706689919";"Hydrology, erosion and nutrient transfers over a transition from semi-arid grassland to shrubland in the South-Western USA: A modelling assessment";"2010";"2";"false";"765"
"7914835613819187545";" Agent-based dynamic spatial simulation of land-use/cover change in the Yucatán peninsula, Mexico GIS/EM4";"2000";"2";"false";"42"
"5952715804931115544";" Ecosystem Service Flow Perspective of Urban Green Land: Spatial Simulation and Driving Factors of Cooling Service Flow";"2023";"2";"false";"295"
"6303789327636434249";"PADI-Simul: An agent-based geosimulation software supporting the design of geographic spaces";"2004";"2";"false";"305"
"10823264842766986539";"Integrating change vector analysis, post-classification comparison, and object-oriented image analysis for land use and land cover change detection using …";"2013";"2";"false";"481"
"16855879992009869572";"A spatial simulation model to explore the long-term dynamics of podocarp-tawa forest fragments, northern New Zealand";"2017";"2";"false";"76"
"9912146033267376668";"A Walloon spatial simulation model of risks in environment and health";"2013";"2";"false";"183"
"7675702261143602202";"Dynamic integrated model for disaster management and socioeconomic analysis (DIM2SEA)";"2018";"2";"false";"609"
"17635315317291339003";"Evolution Simulation and Risk Analysis of Land Use Functions and Structures in Ecologically Fragile Watersheds";"2022";"2";"false";"642"
"17244922423937639850";"Anticipatory Rule Based Spatial Simulation Systems for participatory development, implementation, and evaluation of corporate and governmental plans and policies";"2003";"2";"false";"86"
"6804627286270846316";" Multi-level geosimulation of zoonosis propagation: A multi-agent and climate sensitive tool for risk management in public health";"2010";"2";"false";"133"
"11202051765047636019";"Soil fertility quality assessment based on geographically weighted principal component analysis (GWPCA) in large-scale areas";"2021";"2";"false";"491"
"4312180371675603396";" Simulation-based impact assessment of offshore wind farms on seabirds";"2012";"2";"false";"650"
"15081533488146113409";"… Relationship between Ecosystem Services, Human Health and Well-being and its Implication for Environmental Planning: An Agent-Based Model and Geosimulation";"2021";"2";"false";"339"
"9701019285883955927";"Spatial simulation of hydraulic parameters for fluid flow and transport models";"1989";"2";"false";"328"
"2512508575215730253";" Monitoring, simulation, and management of visitor landscapes";"2008";"2";"false";"829"
"16127615379633053189";"Usability evaluation of the domain specific language for spatial simulation scenarios";"2018";"2";"false";"28"
"12418570602046266652";" Assessment of the Vulnerability of Permafrost Carbon to Climate Change: A Sensitivity Analysis among Models";"2018";"2";"false";"364"
"17347837092926339210";" Australian grassland and rangeland assessment by spatial simulation (AussieGRASS)";"NA";"2";"false";"93"
"4423284159393664308";" Application of Land Use Change and Prediction in Urban Planning Evaluation and Formulation";"NA";"2";"false";"485"
"4779850252997241186";" Agent-based modeling of malaria vectors: the importance of spatial simulation";"2014";"2";"false";"143"
"15361555705048643882";"Spatial simulation and LCA evaluation on the plastic waste recycling system in Tianjin";"2017";"2";"false";"20"
"4480800862381199476";" en Genética y Biología Molecular (RDGBM)";"2017";"2";"false";"581"
"13532263380697027086";" Agent 2007 Conference";"2007";"2";"false";"722"
"12964391657026848049";"A fast assessment methodology for screening of local civil protection plans on a territorial scale basis: A case study of an Italian province";"2022";"2";"false";"522"
"6109963356339384929";" Geosimulation";"2004";"2";"false";"55"
"8855206775790691612";"Book Review: Advanced Geosimulation Models, D. Marceau, and I. Benenson (Eds.). Bentham Books";"2013";"2";"false";"103"
"11396929441616350815";"A Note on Data Simulations for Voting by Evaluation";"2021";"2";"false";"393"
"16551059717315879508";"Evaluation of cultural control and resistance‐breeding strategies for suppression of whitefly infestation of cassava at the landscape scale: a simulation modeling …";"2020";"2";"false";"660"
"11626634799369670329";"Temporal and spatial simulation of atmospheric pollutant PM2. 5 changes and risk assessment of population exposure to pollution using optimization algorithms of the …";"2015";"2";"false";"12"
"18246763254613948161";"Collaborative development of land use change scenarios for analysing hydro-meteorological risk";"2015";"2";"false";"545"
"1600710924585421029";" A Spatial Simulation Model For The Diffusion Of A Novel Biofuel On The Austrian Market.";"2010";"2";"false";"380"
"1363430230905660295";" A deterministic cellular automata model for simulating rural land use dynamics: A case study of Lake Chad Basin";"2012";"2";"false";"574"
"15963323748874034364";" Environmental analysis using integrated GIS and remotely sensed data- Some research needs and priorities";"1991";"2";"false";"628"
"1724355809408483196";" Towards a Virtual Design Media Museum. Identifying, Structuring and Presenting Design and (Re) Presentation Media Artifacts";"2004";"2";"false";"171"
"319314370350236418";"Spatial modeling of the Ulmus pumila growing season in China's temperate zone";"2012";"2";"false";"182"
"2879732242906013459";"A multiagent geosimulation and IoT-based framework for safety monitoring in complex dynamic spatial environments";"2019";"2";"false";"104"
"18036012265331467607";"Initial spatial conditions in simulation models: the missing leg of sensitivity analyses?";"2017";"2";"false";"499"
"17889519263567335907";"Ongoing surveillance protects tanoak whilst conserving biodiversity: applying optimal control theory to a spatial simulation model of sudden oak death";"2019";"2";"false";"379"
"9993864983175439809";" Dynamic Interoperable Geoprocessing and Geosimulation-Scenarios, Frameworks and Prototypes";"2001";"2";"false";"382"
"155930680201083157";"Modeling the spatial variability of forest fuel arrays.";"2002";"2";"false";"686"
"9771983813949140791";"Reservoir Inflow Estimation Using Remote Sensing, GIS and Geosimulation";"2012";"2";"false";"193"
"14398858793550531452";"Managing visitor access to seabird colonies: a spatial simulation and empirical observations";"2007";"2";"false";"244"
"761349238738053054";"Combining crop sensing and simulation modeling to assess within-field corn nitrogen stress";"2015";"2";"false";"571"
"12374220547972423861";"Spatial distribution of interpolation uncertainity: Case study of isotherm map of Serbia (1991-2009)";"2012";"2";"false";"469"
"4046806385112628128";"On geocomputational determinants of entropic variations for urban dynamics studies";"2015";"2";"false";"530"
"17024302833697433481";" Evaluation of downscaled CMIP5 coupled with VIC model for flash drought simulation in a humid subtropical basin, China";"2018";"2";"false";"515"
"11702233363022266833";" A spatial simulation approach to account for protein structure when identifying non-random somatic mutations";"2014";"2";"false";"315"
"7702944794632534097";" 3D Geovisualisation of Noise and Visual impact of a proposed wind farm development using a GIS based visual-acoustic 3D simulation";"2013";"2";"false";"662"
"8977670732919726232";" Integrated Spatial Simulation of Population and Urban Land Use: a Pan-European Model Validation";"2023";"2";"false";"11"
"579761940907214971";"Temperature controls on the spatial pattern of tree phenology in China's temperate zone";"2012";"2";"false";"62"
"206439659605317513";"Understanding the Geographic Dynamics of Goal-Directed Social Behaviors";"2015";"2";"false";"724"
"12938206886463142256";" Spatiotemporal evolution and prediction of land use/land cover changes and ecosystem service variation in the Yellow River Basin, China";"2022";"2";"false";"547"
"18338260324161786794";"The agent-based spatial simulation to the burglary in Beijing";"2014";"2";"false";"31"
"17875042559464398726";"Water quality monitoring and modeling in Lake Kastoria, using GIS. Assessment and management of pollution sources";"2009";"2";"false";"763"
"6141062053559450530";"Habitat suitability assessment of Sichuan sika deer in Tiebu Nature Reserve during periods of green and dry grass";"2014";"2";"false";"622"
"7427050783361990172";"An improved SWAT vegetation growth module and its evaluation for four tropical ecosystems";"2017";"2";"false";"784"
"8296519645928444041";"Efficient non-spatial and spatial simulation of biochemical reaction networks";"2010";"2";"false";"69"
"7784916660942247326";"BIM-Centric Daylight Profiler for Simulation (BDP4SIM): A methodology for automated product model decomposition and recomposition for climate-based daylighting …";"2012";"2";"false";"500"
"15978898889390862510";"Unveiling co-evolutionary patterns in systems of cities: a systematic exploration of the simpopnet model";"2020";"2";"false";"779"
"216454007067813797";" Improving the effect and efficiency of FMD control by enlarging protection or surveillance zones";"2015";"2";"false";"717"
"13528043567327844081";"Using spatial interpolation to construct a comprehensive archive of Australian climate data";"2001";"2";"false";"742"
"9397166039216285438";"Responses of soil N2O emissions and nitrate leaching on climate input data aggregation: a biogeochemistry model ensemble study";"2014";"2";"false";"526"
"11269238895733744687";"Spatial simulation of nitrogen leaching from intensive agriculture in northern Vietnam";"2008";"2";"false";"131"
"2694519139538049804";"Map comparison methods for comprehensive assessment of geosimulation models";"2008";"2";"false";"4"
"15803480346765087874";"Spatial simulation of codesigned land cover change scenarios in New England: alternative futures and their consequences for conservation priorities";"2020";"2";"false";"216"
"15478236057285291054";" Dynamic spatial simulation of residential development in the Hudson River Valley, New York State";"2002";"2";"false";"320"
"896732495545451202";"Biogenic nitric oxide emission from a spruce forest soil in mountainous terrain";"2010";"2";"false";"607"
"9023111040354618320";"Simulation and evaluation of terrestrial ecosystem NPP with M-SDGVM over continental China";"2010";"2";"false";"316"
"9555085081521018898";"Shapefile-based multi-agent geosimulation and visualization of building evacuation scenario";"2023";"2";"false";"329"
"3504858141935373439";" Phenology modeling and regional risk assessment for Tecia solanivora";"2009";"2";"false";"685"
"3465002938699307050";" Effects of Land Use Planning in PERPRES 54/2008 on River Discharges";"2010";"2";"false";"450"
"1061831507063602839";"LANDFIRE: a nationally consistent vegetation, wildland fire, and fuel assessment";"2009";"2";"false";"631"
"5383189887741312892";"A domain specific language for spatial simulation scenarios";"2016";"2";"false";"250"
"2854846564113691903";" Modular system of simulation patterns for a spatialprocesses laboratory";"2006";"2";"false";"487"
"6491020901182356051";" Geosimulation: automata-based modelling of urban phenomena";"2004";"2";"false";"141"
"2552874134430508886";" Ecopath with Ecosim: a user's guide";"2005";"2";"false";"611"
"10112297133781970019";"Calibration of a spatial simulation model with volunteered geographical information";"2011";"2";"false";"6"
"1929166977518988412";" An overview of stochastic spatial simulation";"1996";"2";"false";"43"
"7437179298709057297";" Using cellular automata-Markov analysis and multi criteria evaluation for predicting the shape of the Dead Sea";"2015";"2";"false";"775"
"11878156870446489788";"Using genetic algorithms to estimate confidence intervals for missing spatial data";"2006";"2";"false";"737"
"13984401746719239525";"Spatial simulation: a spatial perspective on individual-based ecology—a review";"2017";"2";"false";"41"
"17366177351321922034";"The ZoonosisMAGS Project (Part 1): Population‐Based Geosimulation of Zoonoses in an Informed Virtual Geographic Environment";"2014";"2";"false";"336"
"14370158283045645158";"Interpolation of precipitation for flood modelling";"2010";"2";"false";"567"
"14753453126254204787";" Automated agent migration over distributed data structures";"2022";"2";"false";"845"
"2932951796362822988";" Multi-Scale assessment and spatio-temporal interaction characteristics of ecosystem health in the middle reaches of the yellow river of China";"2022";"2";"false";"705"
"2457767668906048795";"Validation of a functional-structural tree model using terrestrial Lidar data";"2017";"2";"false";"771"
"5771363129298045268";"Spatial simulation based riverbank slope instability and susceptibility assessment in the Lower River Murray";"2015";"2";"false";"57"
"5035626698477548422";"Spatial simulation methods of regional forest water conservation based on observed data: a review.";"2019";"2";"false";"443"
"53121243638751671";"Urban dynamics analysis using spatial metrics geosimulation";"2011";"2";"false";"297"
"12558378748173087744";" Spatial Simulation Models: What? Why? How?";"2013";"2";"false";"221"
"2767561149674174324";" Geosimulating Hazard Warning Triggers: Geometry, Dynamics, and Timing";"2019";"2";"false";"741"
"11340889197402279127";"Temporal and spatial simulation of production-scale irrigated cotton systems";"2015";"2";"false";"223"
"17567688270839205005";"A moving window-based spatial assessment method for dynamic urban growth simulations";"2022";"2";"false";"323"
"6194658650788587212";"HPC-EPIC for high resolution simulations of environmental and sustainability assessment";"2011";"2";"false";"370"
"12491223914882066591";" A spatial agent-based model for assessment and prediction of woodchips availability for heating plants in Austria";"2014";"2";"false";"570"
"12812905269688109990";" 3DGIS-based multi-agent geosimulation and visualization of building evacuation using GAMA platform";"2014";"2";"false";"152"
"13934489155226465837";"Spatial Simulation and Characterization of Three-Dimensional Fractures in Gejiu tin District, Southwest China, Using GEOFRAC";"2019";"2";"false";"232"
"16428929738514915092";"MASS CUDA: a general GPU parallelization framework for agent-based models";"2019";"2";"false";"709"
"12757258573460960022";"Agent-based services for the validation and calibration of multi-agent models";"2008";"2";"false";"533"
"11718579848517287662";" Space-time representativity of precipitation for rainfall-runoff modelling: experience from some case studies";"2007";"2";"false";"645"
"2208625086891375547";"The evaluation of indices of animal abundance using spatial simulation of animal trapping";"2005";"2";"false";"7"
"9406458251484272263";"Flash flood disaster threat to Indian rail bridges: a spatial simulation study of Machak River flood, Madhya Pradesh";"2017";"2";"false";"258"
"4511943546317792596";"Can current management maintain forest landscape multifunctionality in the Eastern Alps in Austria under climate change?";"2017";"2";"false";"586"
"16544246141027648729";" Comparative evaluation of geospatial scenario-based land change simulation models using landscape metrics";"2021";"2";"false";"668"
"11590222726519231967";" Resilience analysis of maritime silk road shipping network structure under disruption simulation";"2022";"2";"false";"540"
"10398049929443029620";" An integrated GIS-AnnAGNPS modeling interface for non-point source pollution assessment";"2003";"2";"false";"562"
"14764013897683941274";" Science for drought: proceedings of the National Drought Forum";"2003";"2";"false";"702"
"17998263387452303731";"Self-organized and social models of criminal activity in urban environments";"2006";"2";"false";"478"
"9603724387162587143";"Analytical approximation of a stochastic, spatial simulation model of fire and forest landscape dynamics";"2012";"2";"false";"231"
"3514232034013062836";" Probabilistic ecological risk assessment of heavy metals in western Laizhou Bay, Shandong Province, China";"2019";"2";"false";"838"
"11992106079800760970";"Spatially variable pesticide application in olive groves: Evaluation of potential pesticide-savings through stochastic spatial simulation algorithms";"2021";"2";"false";"16"
"298281399220513673";" Stochastic and spatial simulation of contagious animal disease outbreaks.";"1996";"2";"false";"238"
"8382280700251945563";"Where did the ecosystem services value go? Adaptive supply, demand and valuation of new urban green spaces";"2022";"2";"false";"542"
"16768689729721723253";" Spatial simulation of Claviceps gigantea (Fuentes, of the Isla, Ullstrup and Rodríguez) in the State of Mexico.";"2018";"2";"false";"376"
"9409071570776973944";"Dynamic modeling of ecosystems with spatial heterogeneity. A structured approach implemented in Windows environment";"1996";"2";"false";"486"
"17504284003053385134";"A Simple Model of the Climatology of Intermittent Snowpacks: Failures and Lessons";"2010";"2";"false";"551"
"11234718798702236074";"Spatial simulation of smallmouth bass in streams";"1993";"2";"false";"116"
"5309152577680156719";" Australian grassland and rangeland assessment by spatial simulation (Aussie GRASS)(QNR9 Final Report for the Climate Variability in Agriculture …";"NA";"2";"false";"151"
"3211390982732258072";"A dynamic spatial simulation model of land loss and marsh succession in coastal Louisiana";"1988";"2";"false";"277"
"18236581524411907407";"A new algorithm for 3D isovists";"2013";"2";"false";"419"
"17861408351830834096";"An Urban Density-Based Runoff Simulation Framework to Envisage Flood Resilience of Cities";"2023";"2";"false";"658"
"10925407689430220720";" Complexity and planning: Systems, assemblages and simulations";"2016";"2";"false";"750"
"14421930014637366818";"An easy-to-use spatial simulation for urban planning in smaller municipalities";"2018";"2";"false";"64"
"1105872989740346553";"Assessment and protective strategy of black muntjac habitat in Zhejiang, China";"2006";"2";"false";"357"
"2385798242732259920";"Agent‐based models and the spatial sciences";"2010";"2";"false";"633"
"554585179499783565";" Capturing Spatial Simulation specifics in Geographic Information Systems with a UML Profile";"NA";"2";"false";"432"
"5712473052334493070";"Estimating critical climate-driven thresholds in landscape dynamics using spatial simulation modeling: Climate change tipping points in fire management";"2012";"2";"false";"264"
"12249888162698021290";" Australian grassland and rangeland assessment by spatial simulation (Aussie GRASS)";"NA";"2";"false";"96"
"3960577639189592581";"SATCHMO: a spatial simulation model of growth, competition, and mortality in cycling savanna patches";"2007";"2";"false";"45"
"10021248309854286477";" Climate change vulnerability assessment: Review of agricultural productivity";"2008";"2";"false";"712"
"5899091626424581019";"Evaluating the cognitive adequacy of the DLine-region calculus";"2013";"2";"false";"588"
"5568255223094747284";"Spatial simulation of the W-Sn ore grades of São Pedro das Águias skarn mineral deposit (Tabuaço, northern Portugal)";"2016";"2";"false";"66"
"2078374816401756832";"Exploiting data dependency to mitigate stragglers in distributed spatial simulation";"2017";"2";"false";"236"
