"id";"title";"year";"depth";"citingFilled";"geosimvalid"
"10205683474789650410";"Estimation of forest carbon distribution for Xianju county based on spatial simulation.";"2014";"2";"false";"451"
"17657094595441339060";"A model-based assessment of reef larvae dispersal in the Western Indian Ocean reveals regional connectivity patterns—Potential implications for conservation …";"2016";"2";"false";"833"
"12311485564517719515";" Towards a generic approach to develop 2D-3D multiagent geosimulation";"2005";"2";"false";"249"
"5351621991525926642";"An automated and optimized approach for online spatial biodiversity model: a case study of OGC web processing service";"2019";"2";"false";"390"
"15090029405903354146";" A Geosimulation for the Future Spatial Distribution of the Global Population";"2017";"2";"false";"306"
"14759190901641281634";"Evaluation of global climate model on performances of precipitation simulation and prediction in the Huaihe River basin";"2018";"2";"false";"619"
"12152567875747168117";"Geostatistical modeling of spatial uncertainty in a spatially explicit forest landscape model simulation";"2005";"2";"false";"344"
"11370803087241690116";"Computer vision algorithms, vehicle navigation and remote sensing technologies, and smart traffic planning and analytics in urban transportation systems";"2022";"2";"false";"652"
"14047726836088558603";"A Multi-Disciplinary Strategy for Indentifying Affective Usability Aspects in Educational Geosimulation Systems";"2008";"2";"false";"132"
"16782278416098906501";"The Capabilities of Simulation in Spatial Planning.";"2011";"2";"false";"806"
"14921430946007496647";"Spatial simulation model to predict the Colorado potato beetle invasion under different management strategies";"2008";"2";"false";"285"
"2048701030121357287";" A new age for geosimulation";"2005";"2";"false";"417"
"14959699677220473096";"How to involve stakeholders in the modeling process";"2015";"2";"false";"701"
"16602701512466061191";"Assessment of soil erosion dynamics using the GIS-Based RUSLE Model: A case study of wangjiagou watershed from the Three Gorges Reservoir Region …";"2018";"2";"false";"518"
"3019246072661369004";"Spatial simulation and modelling of the early Pleistocene site of DS (Bed I, Olduvai Gorge, Tanzania): a powerful tool for predicting potential archaeological …";"2017";"2";"false";"146"
"13501071104283836716";"Geosimulation and spatial analysis: Linking Cellular Automata and Neural Networks to Forecast Land Use/Cover Change";"2005";"2";"false";"292"
"15760992162941355156";" Risk Management and Assessment";"2020";"2";"false";"694"
"4018475043194509697";"Geospatial Simulation Model of Deforestation and Reforestation Using Multicriteria Evaluation";"2020";"2";"false";"758"
"10290817596550825893";"Wildland surface fire behaviour: a spatial simulation model for operational emergency management";"2021";"2";"false";"313"
"1683385393591837963";"A hybrid CA-ANN-Fuzzy model for simulating coastal changing patterns";"2018";"2";"false";"770"
"14243127569647276057";" A Spatial Simulation Model for the Dispersal of the Bluetongue Vector Culicoides brevitarsis in Australia";"2014";"2";"false";"174"
"7201748256278125817";"E se la forma seguisse la funzione? L'esplorazione della desiderabilità nella città di Skopje";"2013";"2";"false";"637"
"7311824008881096605";" Research data collection at the Reynolds creek experimental watershed";"2007";"2";"false";"726"
"5487434658484902755";"Spatial Simulation of Snow Processes";"1980";"2";"false";"122"
"15462231924786765163";" Integrating multi-criteria analysis and spherical cellular automata approach for modelling global urban land-use change";"2022";"2";"false";"509"
"18001170426736587816";" GEOSIMULATION METHODS FOR SETTLEMENT MORPHOLOGIES ANALYSIS AND TERRITORIAL DEVELOPMENT CYCLES";"2018";"2";"false";"142"
"1352000574316495002";"A spatial simulation model for shadow fading processes in mobile radio channels";"2004";"2";"false";"318"
"6833936631912443972";"Landscape modeling of coastal habitat change in the Mississippi Delta";"2000";"2";"false";"501"
"14059702024758863500";" SPATIAL SIMULATION SYSTEMS AND METHODOLOGIES IN DIGITAL CITIES";"NA";"2";"false";"378"
"17860128158593984993";"Meteorological correlates and AirQ+ health risk assessment of ambient fine particulate matter in Tehran, Iran";"2019";"2";"false";"528"
"12408157066296283630";"Dynamic building environment dashboard: Spatial simulation data visualization in sustainable design";"2017";"2";"false";"243"
"666305124388597384";" A simple agricultural land use model implemented using Geographical Vector Agents (GVA)";"NA";"2";"false";"559"
"2768612542847700070";"An integrated urban development and ecological simulation model";"2000";"2";"false";"766"
"984476102073578692";" SPATIAL SIMULATION OF A (H1N1) INFLUENZA VIRUS SPREADING COMPARISON WITH REGIONAL DATA";"NA";"2";"false";"291"
"7570973061257032887";" SETTLEMENT GROWTH PREDICTION USING NEURAL NETWORK AND CELLULAR AUTOMATA.";"2008";"2";"false";"674"
"12959699282582301516";"Geosimulation and Multicriteria Modelling of Residential Land Development in the City of Tehran: A Comparative Analysis of Global and Local Models";"2017";"2";"false";"225"
"11595280973907963914";"Evaluation of daily precipitation analyses in E‐OBS (v19. 0e) and ERA5 by comparison to regional high‐resolution datasets in European regions";"2022";"2";"false";"727"
"16094142210766374966";"Simulation of spatial sensor characteristics in the context of the EnMAP hyperspectral mission";"2010";"2";"false";"575"
"7668216507259497172";" Activity based variable grid cellular automata for urban and regional modelling";"2011";"2";"false";"319"
"13648701117269265790";"A cellular automata-ready GIS infrastructure for geosimulation and territorial analysis";"2009";"2";"false";"206"
"9566052019558402215";"Enabling geosimulations for global scale: Spherical geographic automata";"2023";"2";"false";"751"
"864528562758849074";"Educational Geostimulation";"2007";"2";"false";"603"
"280337450659949395";" Laboratory simulation techniques in the design process to promote sustainability in architecture";"2004";"2";"false";"828"
"17457790912513729514";"The parallel system for integrating impact models and sectors (pSIMS)";"2013";"2";"false";"437"
"3109804242600882350";" Cambio de uso del suelo y escorrentía superficial: aplicación de un modelo de simulación espacial en Los Ángeles, VIII Región del Biobío, Chile";"2006";"2";"false";"442"
"11878713206725822629";"A future land use simulation model (FLUS) for simulating multiple land use scenarios by coupling human and natural effects";"2017";"2";"false";"635"
"4004362284011188032";"Spatiotemporal simulation of urban growth patterns using agent-based modeling: The case of Tehran";"2013";"2";"false";"591"
"4197203125500349970";"Agent-based evaluation of humanitarian relief goods supply capability";"2019";"2";"false";"446"
"16680849365368743660";"Managing plastic waste from agriculture through reverse logistics and dynamic modeling";"2019";"2";"false";"659"
"9402583479178508769";" The validation of a pasture growth model for monitoring of seasonal conditions in rangelands";"2007";"2";"false";"466"
"6287022581504694227";"Characterization, possible sources and health risk assessment of PM2. 5-bound Heavy Metals in the most industrial city of Iran";"2021";"2";"false";"794"
"6166368692395244872";" … between fleets in the tuna fisheries of western and central pacific using a multi-gear multi-species and age-structured spatial simulation model: a preliminary …";"1999";"2";"false";"457"
"1024549880156202307";"A GIS-based irregular cellular automata model of land-use change";"2007";"2";"false";"634"
"10788466641935135066";"Stochastic simulation of fugitive dust emissions";"1997";"2";"false";"786"
"3612174570486989814";" Real-time Cities";"2008";"2";"false";"476"
"6079206776113272431";" Australian Grassland and Rangeland Assessment by Spatial Simulation (Aussie GRASS) High Rainfall Zone Temperate Pastures Sub-project";"NA";"2";"false";"140"
"5408349833159014278";" Flatfish 2.0 A bio-economical spatial simulation model for plaice (Pleuronectes platessa) and sole (Solea solea) in the North Sea: User manual";"1997";"2";"false";"175"
"4598512131171554827";"A review of wildland fire spread modelling.";"2017";"2";"false";"719"
"84564331075161091";"A hydrological modeling framework for defining achievable performance standards for pesticides";"2012";"2";"false";"738"
"8024093787478510959";"A new grid-scale model simulating the spatiotemporal distribution of PM2. 5-PAHs for exposure assessment";"2016";"2";"false";"850"
"14472793314053472749";"Introduction to NetLogo";"2015";"2";"false";"598"
"3963275461528227946";"Integration of hard and soft supervised machine learning for flood susceptibility mapping";"2021";"2";"false";"804"
"10794210695209625703";"Multiscale modeling: Application to traffic flow";"2017";"2";"false";"656"
"2090969388815352901";" Advances in spatial data handling: Geospatial dynamics, geosimulation and exploratory visualization";"2012";"2";"false";"395"
"4645169198948442518";" Assessment of Australia's grasslands and rangelands by spatial simulation";"NA";"2";"false";"101"
"5375445458567701456";"Technology Framework for Real-Time Assessment of Spatial Conflicts in Building Retrofitting";"2021";"2";"false";"704"
"9811809153637719822";" Models and methods for rural land use planning and their applicability in Galicia (Spain)";"2005";"2";"false";"734"
"5947332431428877603";"Implementation of Traditional Techniques";"2012";"2";"false";"584"
"7494015912501667075";"Introduction to “Space oddity: recent advances incorporating spatial processes in the fishery stock assessment and management interface”";"2017";"2";"false";"790"
"14052527324850903655";" AGNPS model and factors affecting its prediction deviation.";"NA";"2";"false";"555"
"5221850165375227011";" Altimeter-derived soil moisture determination–global scope and validation";"2011";"2";"false";"506"
"1865379839242006459";"Augmenting physical 3D models with projected information to support environmental knowledge exchange";"2019";"2";"false";"640"
"7780736677143120521";" Multi-objective spatial optimization for sustainable landscape design";"2021";"2";"false";"401"
"15716447917062523227";"Book Review: Handbook of Transport Geography and Spatial Systems (D. Hensher, K. Button, K. Haynes and P. Sopher (eds.))";"2006";"2";"false";"594"
"8939869793587954741";" Gene flow in forest trees: from empirical estimates to transgenic risk assessment";"2002";"2";"false";"569"
"14177359195086078167";"A general-purpose geosimulation infrastructure for spatial decision support";"2009";"2";"false";"222"
"5543589589686540212";"Evaluation of CMIP6 Models and Multi-Model Ensemble for Extreme Precipitation over Arid Central Asia";"2023";"2";"false";"672"
"3336384081942880946";"SD–GIS-based temporal–spatial simulation of water quality in sudden water pollution accidents";"2011";"2";"false";"25"
"1744559875005232976";"Optimization methodology for land use patterns—evaluation based on multiscale habitat pattern comparison";"2003";"2";"false";"830"
"14085672528521729909";" Geosimulation: object-based modeling of urban phenomena";"2004";"2";"false";"81"
"10650668304998630129";" Land use change dynamics: A dynamic spatial simulation";"2002";"2";"false";"163"
"12097950507926513656";"Spatial simulation of rock strength properties using a Markov-Bayes method";"1993";"2";"false";"160"
"15195579030395664006";" Review of Modeling and Simulating Urban Processes";"2012";"2";"false";"479"
"2290508934382722649";" Estimation of daily flow rate of photovoltaic water pumping systems using solar radiation data";"2018";"2";"false";"826"
"8823864080962209956";" Dynamic simulation of land use/cover change and assessment of forest ecosystem carbon storage under climate change scenarios in Guangdong Province …";"2022";"2";"false";"517"
"15935204166830521499";"Sensor-Driven, Spatially Explicit Agent-Based Models";"2019";"2";"false";"802"
"11558355469494590392";"Modeling the emergence of riots: A geosimulation approach";"2017";"2";"false";"205"
"7858420015349863155";"Review of Geospatial Techniques in Urban Planning (Advances in Geographic Information Science)";"2013";"2";"false";"471"
"16786550798051560016";"Data Assimilation and Geostatistics in Ecological Modeling";"2001";"2";"false";"809"
"18315514103561922558";" The importance of volunteered geographic information for the validation of flood inundation models";"2018";"2";"false";"327"
"4871549465898671840";"Agent-based multicomponent spatial simulation of a fishery";"2020";"2";"false";"321"
"2735146698690552261";"Spatial simulation of redistribution of fishing effort in Nigerian coastal waters using Ecospace";"2019";"2";"false";"211"
"5331804218443250847";"A hybrid approach integrating entropy-AHP and GIS for suitability assessment of urban emergency facilities";"2020";"2";"false";"539"
"998197162580545134";" An agent-based simulation of the Swiss labour market: an alternative for the labour market policy evaluation";"2013";"2";"false";"811"
"3281320190974832773";"Modeling combined geological and grade uncertainty: application of multiple-point simulation at the Apensu gold deposit, Ghana";"2013";"2";"false";"678"
"5498929782226807378";"Agent-based geosimulation for assessment of urban emergency response plans";"2018";"2";"false";"1"
"10700924639890908264";"The impact of interactions in spatial simulation of the dynamics of urban sprawl";"2005";"2";"false";"44"
"6306524761249111689";"Assessment of landslide susceptibility zonation using frequency ratio and statistical index: a case study of Al-Fawar basin, Tartous, Syria";"2022";"2";"false";"810"
"5180590765555264826";"A preliminary study: An agent-based spatial simulation of human-coastal environment interaction in coastal urban tropical area";"2017";"2";"false";"172"
"771614813213926504";"Two studies on the control of wildlife-derived tuberculosis: farmer views and model validation: a thesis presented in partial fulfilment of the requirements for the degree …";"2002";"2";"false";"807"
"9172987646387729379";"Spatial simulation of contrail formation in near-field of commercial aircraft";"2015";"2";"false";"303"
"1032568769245268407";" Implementing a Geoinformatics Course for Secondary Schools: First Lessons to be Learned";"2014";"2";"false";"616"
"12498303701013360409";"A method to model neighborhood interactions in geosimulation of urbanization processes";"2006";"2";"false";"113"
"10761628490186957308";" Modelling the potential distribution of an invasive mosquito species: comparative evaluation of four machine learning methods and their combinations";"2018";"2";"false";"167"
"5996769342500942720";" Integrated assessment of land-use/land-cover dynamics on carbon storage services in the Loess Plateau of China from 1995 to 2050";"2021";"2";"false";"731"
"2021618531757955940";"Spatial simulation of epizootics caused by Beauveria bassiana in Russian wheat aphid populations";"1999";"2";"false";"204"
"8466178633542623795";"Integrating multi-agent evacuation simulation and multi-criteria evaluation for spatial allocation of urban emergency shelters";"2018";"2";"false";"715"
"10538030333255031810";"Combining indicators for decision making in planning issues: A theoretical approach to perform sustainability assessment";"2019";"2";"false";"831"
"8523723432867184510";" CLEANED tool: Live spatial simulation to develop a shared vision for a sustainable livestock value chain transformation";"2018";"2";"false";"464"
"9412614424780606291";"Cellular automata and multi-agent systems as planning support tools";"2003";"2";"false";"441"
"4633329809762871506";"MAELIA-OWM: agro-environmental and socio-economic modelling and assessment tool for territorial management of organic resources";"2020";"2";"false";"548"
"6587577223158781691";" The Dynamic Spatial Simulation Modelling of the Effects of Land Use Change on Avian Species";"NA";"2";"false";"218"
"17553129821960867263";" Evaluation of the performance of different atmospheric chemical transport models and inter-comparison of nitrogen and sulphur deposition estimates for the …";"2015";"2";"false";"792"
"649138459412153785";"Reporting on the performance and usability of planning support systems—Towards a common understanding";"2020";"2";"false";"409"
"16048469994894734660";"Examining spatial carbon metabolism: Features, future simulation, and land-based mitigation";"2020";"2";"false";"549"
"15042053775277277452";"Discussion on rapid evaluation method of large-scale land degradation in China";"2022";"2";"false";"837"
"8065491431735050448";" Discussion on the application of geographic information system in urban ecological environment management under the background of big data";"2020";"2";"false";"808"
"3811212801011126871";"Validity of Cost-Benefit Analysis for Flood Prevention Projects: Insights from Sensitivity Analysis";"2009";"2";"false";"337"
"5237079916450501734";"Defining spatial structure for fishery stock assessment";"2020";"2";"false";"761"
"13991890158210568799";"A spatial simulation model for forest succession in the Upper Mississippi River floodplain";"2009";"2";"false";"262"
"13027696333487021839";"Experimental results and spatial simulation of climate in a greenhouse with insect screens";"2009";"2";"false";"181"
"3097976691785935159";" Dinamica: a new model to simulate and study landscape dynamics";"2002";"2";"false";"851"
"16732235955509455895";" A methodology for automated geosimulation model generation";"2013";"2";"false";"392"
"1852963559274838907";"Evaluation of model validation techniques in land cover dynamics";"2013";"2";"false";"561"
"16182614902334606745";"Revisiting Kappa to account for change in the accuracy assessment of land-use change models";"2011";"2";"false";"434"
"4126981562147849979";"Validation of a spatial simulation model of a spreading alien plant population";"2001";"2";"false";"2"
"17616088239490739598";"Senstitivity analysis for spatial simulation of urban growth";"2010";"2";"false";"67"
"16045341941888871579";" Techniques and tools for three dimensional visualisation and communication of spatial agent-based models";"2008";"2";"false";"494"
"17403553255402860038";"Assessment of GCMs simulation performance for precipitation and temperature from CMIP5 to CMIP6 over the Tibetan Plateau";"2021";"2";"false";"666"
"8050453556175169604";"Methods to evaluate the performance of spatial simulation models";"1989";"2";"false";"185"
"9897195213601684629";"Proceedings of the AARC-ECAW Inception Workshop, Landmark Hotel, Dar es Salaam, Tanzania, November 3-7, 2011";"2011";"2";"false";"582"
"440219634071205353";"An Application of Graphics Processing Units to Geosimulation of Collective Crowd Behaviour";"2017";"2";"false";"149"
"13594676198393125253";"Development and evaluation of virtual reality medical training system for anatomy education";"2015";"2";"false";"752"
"9359513512053428307";"Resampling with in situ field portable X-ray fluorescence spectrometry (FPXRF) to reduce the uncertainty in delineating the remediation area of soil heavy metals";"2021";"2";"false";"565"
"2171555791751005475";"The space of people in architectural computation: a conceptual framework for the design computation of human-centric spatial environments";"2015";"2";"false";"596"
"9943124263429939695";"Spatial variability and sensitivity analysis on the compressive strength of hollow concrete block masonry wallettes";"2017";"2";"false";"648"
"14955447998551241035";"Mapping historical livestock grazing pressure in Queensland";"2016";"2";"false";"556"
"674776344170727534";"Corrosion modeling, simulations and assessment through intelligent computations";"2009";"2";"false";"266"
"18107609594015253631";"Partitioning spatial model uncertainty based on joint spatial simulation";"2004";"2";"false";"293"
"17980728565047151783";"Spatial simulation using abstraction of virtual geographic environments";"2018";"2";"false";"371"
"4775706268291481982";" Modeling and measuring the economic success of farming families using remote sensing and GIS: An example from mountains of Nepal";"2011";"2";"false";"388"
"1244859279975364799";" Geosimulation: Automata-based modeling of urban phenomena";"2004";"2";"false";"34"
"10184100882867249706";"A spatial simulation approach to natural forest landscape dynamics in boreal Fennoscandia";"2002";"2";"false";"68"
"3779662538257251045";" Towards Interactive Visual Analysis of Microscopic-Level Simulation Data.";"2012";"2";"false";"669"
"17383411140410416833";"Linking linear programming and spatial simulation models to predict landscape effects of forest management alternatives";"2006";"2";"false";"261"
"13962457117301151542";"Grid-boxing for spatial simulation performance optimisation";"2006";"2";"false";"350"
"3529184959875705617";" MASS HDFS: Multi-Agent Spatial Simulation Hadoop Distributed File System";"2018";"2";"false";"257"
"2430440405970180585";" Three-Dimensional Structural and Spatial Simulation in the Studio";"1988";"2";"false";"119"
"10132169396554602507";"Regional air pollution assessment by cumulative semivariogram technique";"1995";"2";"false";"821"
"2973149826753441709";" Agent-based Spatial Simulation with NetLogo, Volume 2: Advanced Concepts";"2016";"2";"false";"324"
"9733484792695662871";"Simulation informal urban growth in Dar es Salaam, Tanzania-A CA-based land-use simulation model supporting strategic urban planning";"2011";"2";"false";"614"
"14366967561925560913";"An algorithmic model for invasive species: application to Caulerpa taxifolia (Vahl) C. Agardh development in the North-Western Mediterranean Sea";"1998";"2";"false";"454"
"12215158368989753043";"Spatial agent-based modeling to explore slum formation dynamics in Ahmedabad, India";"2018";"2";"false";"546"
"6263228550310531148";"Complex network-based research on the resilience of rural settlements in Sanshui watershed";"2021";"2";"false";"47"
"8209982950186320870";"Calibration of distributed hydrological models considering the heterogeneity of the parameters across the basin: a case study of SWAT model";"2021";"2";"false";"671"
"9435622914833146902";" A new high-order, nonstationary, and transformation invariant spatial simulation approach";"2017";"2";"false";"429"
"13714352722786695763";" Simulasi spasial berbasis sistem informasi geografi dan cellular automata untuk pemodelan perubahan penggunaan lahan di daerah pinggiran kota …";"2013";"2";"false";"740"
"12835072971026879297";" About Virtual Spatial Modelling in Architectural Education, Spatial Simulation and Evaluation. New Tools in Architectural and Urban Design";"NA";"2";"false";"63"
"5281858968018534682";"Spatial Simulation of Land Degradation in The Qazvin Plain Using A Frequency Ratio Model";"2022";"2";"false";"386"
"11702628347935981224";"Assessment of stormwater pollutant loads and source area contributions with storm water management model (SWMM)";"2019";"2";"false";"259"
"3322999375626868111";"Space matters: Extending sensitivity analysis to initial spatial conditions in geosimulation models";"2018";"2";"false";"3"
"1954938384554315664";" A High-Performance Geospatial Architecture for Geosimulations";"2018";"2";"false";"366"
"4104012577105316282";"County level calibration strategy to evaluate peanut irrigation water use under different climate change scenarios";"2023";"2";"false";"543"
"8672643938972279788";" simSALUD: Design and implementation of an open-source wizard based spatial microsimulation framework";"2017";"2";"false";"325"
"14934034802384991338";"Incorporating spatial complexity into economic models of land markets and land use change";"2011";"2";"false";"844"
"4662056888257512260";" Mapping and Forecasting Land Use: The Present and Future of Planning";"2022";"2";"false";"477"
"12503126145900500320";"Influences of changing land use and CO2 concentration on ecosystem and landscape level carbon and water balances in mountainous terrain of the Stubai Valley …";"2009";"2";"false";"773"
"1751432608987801579";"Futures-dpe: towards dynamic provisioning and execution of geosimulations in hpc environments";"2018";"2";"false";"483"
"6425034987681547708";" Rule-based spatial modeling with diffusing, geometrically constrained molecules";"2010";"2";"false";"820"
"9096665763551753820";" Area-wide management guidelines for Sterile Insect Technique developed through interdisciplinary modelling research";"2019";"2";"false";"620"
"2004917552882599440";" coupling Multiagent geosimulation and Spatial olap for Better geosimulation data analysis";"2007";"2";"false";"50"
"2199123607832435259";"Improving correction quality for in-situ portable X-ray fluorescence (PXRF) using robust geographically weighted regression with categorical land-use types at a …";"2022";"2";"false";"127"
"2707664417363397361";" The geosimulation of West Nile virus propagation: a multi-agent and climate sensitive tool for risk management in public health";"2008";"2";"false";"109"
"14225224662263345375";"Multidisciplinary assessment of nearshore nursery habitat restoration for an exploited population of marine fish";"2021";"2";"false";"480"
"6328339468320343072";"Aussie GRASS: Australian grassland and rangeland assessment by spatial simulation";"2000";"2";"false";"0"
"5696444165413095503";"Geosimulation, automata, and traffic modeling";"2004";"2";"false";"59"
"4615186167024252763";"A massively multi-user online game framework for agent-based spatial simulation";"2019";"2";"false";"255"
"17580874888154597104";"A review of current calibration and validation practices in land-change modeling";"2016";"2";"false";"402"
"13797113217849971608";"An agent-based spatial simulation to evaluate the promotion of electricity from agricultural biogas plants in Germany";"2013";"2";"false";"169"
"2630575919262382957";"Spatial simulation of snow and frozen ground using a modified temperature-based model";"2018";"2";"false";"269"
