"id";"title";"year";"depth";"citingFilled";"geosimvalid"
"2573636539366150217";"Between Games and Simulation: Gamification and Convergence in Creative Computing";"2016";"2";"false";"729"
"5009266697042695678";" Towards a'pattern language'for spatial simulation models";"2013";"2";"false";"137"
"15291379627993605290";"Slipstreaming human geosimulation in virtual geographic environments";"2015";"2";"false";"299"
"2508944272247407007";" High-order data-driven spatial simulation of categorical variables";"2022";"2";"false";"213"
"3755811745936853970";"HOMINIDS: An agent-based spatial simulation model to evaluate behavioral patterns of early Pleistocene hominids";"2010";"2";"false";"234"
"8227652364381073175";"Questions of uncertainty in geography";"2017";"2";"false";"436"
"10705787949391534158";" Methods of economic impact assessment";"1999";"2";"false";"801"
"6208548717626232584";"Generating a close-to-reality synthetic population of ghana";"2012";"2";"false";"835"
"6381874958995867842";"Scenario-based evaluation of urban development sustainability: an integrative modeling approach to compromise between urbanization suitability index and …";"2015";"2";"false";"762"
"9543745073724913814";"Smart tools in risk communication: how can we reach flood-resilient cities?";"2018";"2";"false";"396"
"1219088751204456162";"Ifao-simo: A spatial-simulation based facility network optimization framework";"2007";"2";"false";"192"
"14326935560336622895";"Spatial surplus production modeling of Atlantic tunas and billfish";"2011";"2";"false";"728"
"16056935760262317340";"Geographical vector agent-based simulation for agricultural land-use modelling";"2011";"2";"false";"460"
"2517499650887726423";"Spatial simulation of landscape changes in Georgia: a comparison of 3 transition models";"1987";"2";"false";"189"
"7945923572875759040";"The effect of spatial resolution on the performance of cellular automata-based land use change spatial simulation";"2019";"2";"false";"106"
"7463075123218626479";" Integrated drought vulnerability and risk assessment for future scenarios: An indicator based analysis";"2023";"2";"false";"788"
"17976255584271975611";"GIS-based spatial simulation of impacts of urban development on changing both land cover area and land surface temperature in Dhaka city";"2012";"2";"false";"278"
"1899622636342487980";"An exploration of the effect of buyer preference and market composition on the rent gradient using the ALMA framework";"2020";"2";"false";"743"
"8881251723394828836";" Aussie GRASS: Australian grassland and rangeland assessment by spatial simulation";"NA";"2";"false";"126"
"7266996772727201476";"Spatial openness and student activities in an atrium: A parametric evaluation of a social informal learning environment";"2020";"2";"false";"814"
"7454683757438132283";"Spatial modelling of vegetation change in dynamic landscapes: a review of methods and applications";"2006";"2";"false";"824"
"12852468803399222782";"Multi-Agent Geosimulation In Support To “What if” Courses Of Action Analysis";"2010";"2";"false";"91"
"9882940611019265869";" Departure to New Worlds";"2016";"2";"false";"573"
"15468321195466786677";"Evaluation and application of Bayesian multi-model estimation in temperature simulations";"2013";"2";"false";"639"
"4030544258293931923";" Dynamic land use/cover change modelling: geosimulation and agent-based modelling";"2011";"2";"false";"51"
"15573628205946222533";"A critical assessment of pedestrian behaviour models";"2009";"2";"false";"839"
"18356627631770221827";"Forecasting energy technology diffusion in space and time: model design, parameter choice and calibration";"2020";"2";"false";"272"
"1898903667327033597";"Spatially distributed simulation of evapotranspiration, soil water dynamics, and groundwater recharge in Northeast German agrolandscapes";"2001";"2";"false";"606"
"10180432131922616893";"Spatial simulation of soil total potassium in regional scale for Loess Plateau Region";"2012";"2";"false";"412"
"897506323877348657";" Prevention Acts to Bioweapons & Bioterrorism–The Use of Spatial Risk Assessment Tools for Control Systems' Disaster Management, ed";"NA";"2";"false";"846"
"14620238469028950546";"Baseline Error Analysis and Experimental Validation for Height Measurement of Formation Insar Satellite";"2018";"2";"false";"524"
"973774396786090528";"Intercalibration of Luojia1-01 and Suomi-NPP-VIIRS Monthly Nighttime Light Composite Using a Spatial-Temporal Residuals Correction Random Forest Model";"2022";"2";"false";"523"
"8840111856404507673";"Spatial Distribution and Geosimulation of Non-timber Forest Products for Food Security in Conflict Area";"2022";"2";"false";"355"
"7066610953991948205";" Leaving the Ivory Tower of a System Theory: From Geosimulation of Parking Search to Urban Parking Policy-Making";"2012";"2";"false";"148"
"3371576490520007710";"Multi-criteria risk evaluation by integrating an analytical network process approach into GIS-based sensitivity and uncertainty analyses";"2018";"2";"false";"735"
"17883023633887711992";" (2000) AussieGRASS: Australian grassland and rangeland assessment by spatial simulation";"NA";"2";"false";"145"
"1411589410888989334";"Interpolation of groundwater quality parameters with some values below the detection limit";"2011";"2";"false";"791"
"1826241813421597236";" A complex systems approach to dynamic spatial simulation modeling: LandUse and LandCover change in the Ecuadorian Amazon";"2001";"2";"false";"219"
"10955558573352415014";" A deep learning approach for Spatio-Temporal forecasting of new cases and new hospital admissions of COVID-19 spread in Reggio Emilia, Northern Italy";"2022";"2";"false";"776"
"556878450946647352";" Enacting space in virtual reality: A comparison between Money's Road Map test and its virtual version";"2018";"2";"false";"605"
"9312148944070493569";" Review of spatial simulation tools for geographic information systems";"2011";"2";"false";"161"
"13690201005702381681";"A domain specific language for spatial simulation scenarios (DSL3S) introduction and tool support";"2015";"2";"false";"226"
"8043981378780825049";"Cellular automata simulation of urban dynamics through GPGPU";"2013";"2";"false";"755"
"8557260919597228654";"Measurement indicators and an evaluation approach for assessing urban sustainable development: A case study for China's Jining City";"2009";"2";"false";"787"
"4920252403657256406";" Don't stop 'til you get enough-sensitivity testing of Monte Carlo iterations for model calibration";"2005";"2";"false";"683"
"1298222016849520297";"Exploring the use of systems dynamics in sustainable urban retrofit planning";"2014";"2";"false";"577"
"1744610543736415469";"Evaluation and projection of wind speed in the arid region of northwest China based on CMIP6";"2021";"2";"false";"600"
"1215122595272546352";"Scenario-based flood risk assessment for urbanizing deltas using future land-use simulation (FLUS): Guangzhou Metropolitan Area as a case study";"2020";"2";"false";"655"
"155842396999406589";"A new method to model neighborhood interaction in cellular automata-based urban geosimulation";"2007";"2";"false";"61"
"16664500491392313775";"GIS-MCDA for group decision making";"2015";"2";"false";"558"
"14723504217337451593";"Exploring cruising using agent-based and analytical models of parking";"2013";"2";"false";"836"
"16761415006494862465";" Spatial Simulation of Land-Use Development of Feixi County, China, Based on Optimized Productive–Living–Ecological Functions";"2022";"2";"false";"13"
"2148083824886889593";"Spatial simulation of the ecological processes of stormwater for sponge cities";"2019";"2";"false";"197"
"7501829096654382014";"High-resolution multi-temporal mapping of global urban land using Landsat images based on the Google Earth Engine Platform";"2018";"2";"false";"473"
"6448328955983521176";"Theoretical and experimental evaluation of a two dimensional composite matrix array";"1990";"2";"false";"391"
"18358771129164396008";" Spatial simulation of forest using Bayesian state-space models and remotely sensed data";"2006";"2";"false";"77"
"11926762899238580591";"Dynamic spatial simulation modeling of the population—environment matrix in the Ecuadorian Amazon";"2005";"2";"false";"147"
"9326929525483006576";"Filter-based classification of training image patterns for spatial simulation";"2006";"2";"false";"90"
"10205577295611102094";"K-fold Cross-validation of Multiple-point Statistical Simulations";"2019";"2";"false";"310"
"4562581989074464849";"Spatial simulation for translating from land use to land cover";"2004";"2";"false";"17"
"9104522161664271537";" Impacts and trade-offs of future land use and land cover change in Scotland: spatial simulation modelling of shared socioeconomic pathways (SSPs) at regional …";"2020";"2";"false";"71"
"18002049498638212408";" Spatial simulation of crop conditions-application for crop risk monitoring, crop management and water footprint estimation";"2013";"2";"false";"129"
"11823541733697974311";"Vehicular CO emission prediction using support vector regression model and GIS";"2018";"2";"false";"682"
"12596993045916095809";"Spatial simulation modelling of future forest cover change scenarios in Luangprabang province, Lao PDR";"2011";"2";"false";"32"
"7020690852108022491";" Method for Spatial Simulation of Topsoil Organic Matter in China based on a Neural Network Model";"NA";"2";"false";"239"
"70007378794014671";" Department of Conservation biodiversity indicators: 2012 assessment";"2012";"2";"false";"782"
"12344778827846488356";"Prediction of climate warming impacts on plant species could be more complex than expected. Evidence from a case study in the Himalaya";"2014";"2";"false";"745"
"558824081214568608";"Analysis of Agent-Based Parallelism for Use in Clustering and Classification Applications";"2018";"2";"false";"805"
"10217618443427796531";" Agent-based dynamic spatial simulation of land-use/cover change: methodological aspects";"NA";"2";"false";"200"
"9124067526638508213";" LU decomposition conditional simulations for exploration strategy evaluations";"1991";"2";"false";"242"
"7727738431289993878";"Trophic state assessment of Bhindawas lake, Haryana, India";"2017";"2";"false";"753"
"3815234438996086971";" Dynamic land use/cover change modelling: Geosimulation and multiagent-based modelling";"2011";"2";"false";"35"
"4266379080726314419";"Spatial simulation and land-subsidence susceptibility mapping using maximum entropy model";"2019";"2";"false";"136"
"5064221497844520065";"ZoonosisMAGS Project (Part 2): Complementarity of a Rapid‐Prototyping Tool and of a Full‐Scale Geosimulator for Population‐Based Geosimulation of Zoonoses";"2014";"2";"false";"100"
"10767958449157868192";" Uncertainty analysis of urban sewer system using spatial simulation of radar rainfall fields: New York City case study";"2018";"2";"false";"79"
"1536282420316152337";"3D LIDAR Data Application for Urban Morphogenesis Multi-agent Vector Based Geosimulation";"2008";"2";"false";"227"
"17357986263709012598";"Methods and tools for addressing natural disturbance dynamics in conservation planning for wilderness areas";"2014";"2";"false";"415"
"15108348321334995360";"Using cognitive archetypes and conceptual graphs to model dynamic phenomena in spatial environments";"2007";"2";"false";"553"
"8727940478317933305";" Australian grassland and rangeland assessment by spatial simulation (AussieGRASS). Final Report prepared for the Managing Climate Variability …";"NA";"2";"false";"156"
"16032503125606761254";"Evaluating control strategies for outbreaks in BHV1-free areas using stochastic and spatial simulation";"2000";"2";"false";"82"
"14998992015589772077";"Trophic models of four benthic communities in Tongoy Bay (Chile): comparative analysis and preliminary assessment of management strategies";"2002";"2";"false";"489"
"15980513163743387580";"Sequential spatial simulation using Latin hypercube sampling";"2004";"2";"false";"48"
"12575566594951093527";"Combination of process-oriented and pattern-oriented models of land-use change in a mountain area of Vietnam";"2007";"2";"false";"629"
"17456811808860689619";" Spatial and temporal distribution of snow cover in the upper Hron River basin in hydrological years 1962–2001";"NA";"2";"false";"703"
"5747642080953584435";"Spore establishment probability and the persistence of the fugitive invading moss, Orthodontium lineare: a spatial simulation model";"1991";"2";"false";"97"
"11869117116306000848";"Empirical calibration of spatially explicit agent-based models";"2011";"2";"false";"199"
"11203879699880276451";"Data Preparation and Processing";"2012";"2";"false";"583"
"541634811499322519";" Evaluation of euclidean shortest path, voronoi digram and line segement intersection using mass, spark, and mapreduce";"2022";"2";"false";"413"
"17768102568440853162";"Modelling forest canopy trends with on-demand spatial simulation";"2016";"2";"false";"180"
"10599422786944316385";"Spatial simulation of evapotranspiration of semi-arid Inner Mongolian grassland based on MODIS and eddy covariance data";"2012";"2";"false";"296"
"1288532572861304200";" Collision-free agent migration in spatial simulation";"2017";"2";"false";"270"
"14770703179801073539";"A framework to support qualitative reasoning about COAs in a dynamic spatial environment";"2010";"2";"false";"534"
"4328477339628044113";"An assessment of empirical methods for modeling land use";"2014";"2";"false";"566"
"17402517532425760333";"Multi-Agent Geosimulation of Urban Dynamics within the V-Devs Framework.";"2009";"2";"false";"527"
"10259703441243778361";" Arm posture changes and influences on hand controller interaction evaluation in virtual reality";"2022";"2";"false";"653"
"7993003974179813855";"A spatial simulation model of hydrology and vegetation dynamics in semi‐permanent prairie wetlands";"1993";"2";"false";"80"
"17532098088706989324";"Spatial variability and simulation of soil organic carbon under different land use systems: geostatistical approach";"2019";"2";"false";"812"
"18038055848869330184";"Extreme climate events and agricultural climate indices in China: CMIP5 model evaluation and projections";"2016";"2";"false";"493"
"860399968403467560";"A modified method of multiple point geostatistics for spatial simulation of sedimentary facies for carbonate reservoirs";"2023";"2";"false";"58"
"14625219072708802890";"Modeling the Land Use/Cover Change in an Arid Region Oasis City Constrained by Water Resource and Environmental Policy Change using Cellular Automata …";"2017";"2";"false";"535"
"15043107155594073741";" The integration of digital twin and serious game framework for new normal virtual urban exploration and social interaction";"2023";"2";"false";"664"
"8254625668557723684";"A classification of landscape fire succession models: spatial simulations of fire and vegetation dynamics";"2004";"2";"false";"467"
"9408051125500815146";"Dynamic load balancing in multi-agent spatial simulation";"2015";"2";"false";"105"
"10968980215889667633";"Monitoring and Spatially Explicit Simulation of Land Use Dynamics: From Cellular Automata to Geosimulation-A Case Study of Tehran, Iran";"2011";"2";"false";"314"
"3919737379956407288";" A Stochastic Spatial Simulation Method for Self-Assembly Reactions";"2019";"2";"false";"282"
"8759010332422015051";"Spatial uncertainty assessment of the environmental risk of soil copper using auxiliary portable X-ray fluorescence spectrometry data and soil pH";"2018";"2";"false";"85"
"876599398238671684";"Evaluation and prediction of ecosystem service value in the Zhoushan Islands based on LUCC";"2021";"2";"false";"767"
"4726371467208296922";"MAGS Project: Multi-agent geosimulation and crowd simulation";"2003";"2";"false";"229"
"2184169285977474026";"A spatial simulation model to assess controls upon grassland degradation on the Qinghai-Tibet Plateau, China";"2018";"2";"false";"46"
"9030884982365865995";"Spatial simulation and prediction of air temperature based on CNN-LSTM";"2023";"2";"false";"165"
"9391569498830104992";" Locating the position of a scenario projection in solution space";"NA";"2";"false";"279"
"6263254630079349721";" Spatial simulation: environmental applications";"1993";"2";"false";"155"
"13472651498175384403";"Should neighborhood effect be stable in urban geosimulation model? A case study of Tokyo";"2010";"2";"false";"108"
"11959190584191838664";"Daily temperature-based temporal and spatial modeling of tree phenology";"2013";"2";"false";"245"
"4556624666568855640";" Spatial resilience assessment and optimization of small watershed based on complex network theory";"2022";"2";"false";"560"
"7358221751619339400";"Spatial simulation model of urban retail system (wip)";"2012";"2";"false";"118"
"6602220033013626647";"Agent-based Spatial Simulation with NetLogo, Volume 2";"2017";"2";"false";"312"
"1171215705197888623";"The EXPO'98 CD-ROM: a multimedia system for environmental exploration";"2021";"2";"false";"643"
"12647782328097656865";"A spatial simulation model to explore agglutination of residential areas and public service facilities";"2015";"2";"false";"87"
"3227645170063137441";"Traffic accident spatial simulation modeling for planning of road emergency services";"2019";"2";"false";"184"
"13834818222715015213";" Dispersal and management of invasive aquatic plants in Mississippi waterways";"2013";"2";"false";"624"
"16670959759943083245";"A joint standard-exceeding risk assessment of multiple pollutants based on robust geostatistics with categorical land-use type data: A case study of soil nitrogen and …";"2022";"2";"false";"36"
"17690152134808630932";"Performance assessment of geospatial simulation models of land-use change—a landscape metric-based approach";"2016";"2";"false";"462"
"12750120954653516594";"A Geosimulation Tool to Assess Intervention Scenarios in Relation to the Spread of Infectious Disease and Environmental Factors";"2010";"2";"false";"135"
"6372523834060882210";" Redevelopment of the DSSAT Model using C++ for Facilitation of Large Scale Data Processing";"NA";"2";"false";"667"
"17764957302102281328";"Evaluation of a two-stage SVM and spatial statistics methods for modeling monthly river suspended sediment load";"2016";"2";"false";"695"
"5206998475514442797";"Australian Grassland and Rangeland Assessment by Spatial Simulation (AussieGRASS) 210";"NA";"2";"false";"53"
"8451837683476554204";" Implementing the Multi-agent spatial simulation (MASS) library on the Graphics Processor Unit";"2012";"2";"false";"381"
"15565134607397083623";" From PM2. 5 exposure to PM2. 5 risks of inhaled dose in daily activities: Empirical evidence during workdays from Guangzhou, China";"2021";"2";"false";"590"
"15192592363373747907";"Multi-scenario analysis of land space based on PLUS and MSPA";"2023";"2";"false";"504"
"8258951611903277002";"Spatial validation of cotton simulation model in relation to soils and multispectral imagery";"2003";"2";"false";"684"
"12009714523870025146";"The application and realization of 3D geosimulation and forecast in the field of bank collapse research based on GIS";"2008";"2";"false";"377"
"7071959414652029423";"Land-use changes in southern Appalachian landscapes: spatial analysis and forecast evaluation";"1998";"2";"false";"849"
"14610349399752576497";"Spatial simulation of population in Shandong Province based on night-time imagery and land cover data";"2021";"2";"false";"162"
"16675899376036160161";"A parallel multi-agent spatial simulation environment for cluster systems";"2013";"2";"false";"40"
"3563645024911198826";"Spatial simulation of pushbelt CVTs with time-stepping schemes";"2012";"2";"false";"265"
"2780538817014325376";" Ecodynamics";"NA";"2";"false";"595"
"7044015623248627718";" Multiple-purchaser payments for ecosystem services: An exploration using spatial simulation modelling";"2019";"2";"false";"15"
"5982644363607019965";" SPATIAL SIMULATION OF A SKI RESORT: AN AGENT-BASED MODEL";"NA";"2";"false";"424"
"8680772264763423297";"Economics of Weather Risk Management Using Climate Prediction Models";"2005";"2";"false";"842"
"12780476902075345092";"Urban geosimulation";"2011";"2";"false";"89"
"6808979722706937915";" A Spatial Simulation Model of Lake-edge Wetland Formation";"1979";"2";"false";"341"
"1414370533666618667";" Assessment of non-point source pollution export from Zigui county in the Three Gorges Reservoir area using the AnnAGNPS model";"2011";"2";"false";"374"
"9046792392800915400";"Controlling virtual clouds and making it rain particle systems in real spaces using situated augmented simulation and portable virtual environments";"2012";"2";"false";"511"
"17819154351185009292";"Multidimensional Evaluation of Public Transport Accessibility";"2018";"2";"false";"490"
"16494420649760802731";"Spatial simulation of the adaptability of Monochamus alternatus hope in Yunnan province.";"2013";"2";"false";"201"
"375134651892978378";"Forecasting the benefits of no-take human-made reefs using spatial ecosystem simulation";"2002";"2";"false";"706"
"16908431994986544025";"Introducing 3-PG2Py, an open-source forest growth model in Python";"2022";"2";"false";"214"
"10652491215842559456";"Urban geosimulations with the Logic Scoring of Preference method for agent-based decision-making";"2018";"2";"false";"405"
"4422004924321258713";"Spatial simulation modeling of settlement distribution driven by random forest: consideration of landscape visibility";"2020";"2";"false";"275"
"18099078912714012293";"Mechanisms maintaining biodiversity in Mediterranean pine-oak forests: insights from a spatial simulation model";"2004";"2";"false";"196"
"1141013621187126015";" Environmental planning using spatial agents";"1998";"2";"false";"797"
"18328166108071645739";" A spatial agent based model for simulating and optimizing networked eco-industrial systems";"2020";"2";"false";"385"
"1345056228191211263";"Spatial simulation of forest succession and timber harvesting using LANDIS";"2000";"2";"false";"248"
"10346804760493557959";" Evaluation of CMIP6 for historical temperature and precipitation over the Tibetan Plateau and its comparison with CMIP5";"2020";"2";"false";"508"
"13362000769122207075";"Development of a framework for fire risk assessment using remote sensing and geographic information system technologies";"2010";"2";"false";"772"
"10414927945025651703";"Geosimulation and its application to urban growth modeling";"2006";"2";"false";"191"
"17442780364154378463";"Introduction to the agent approach";"2015";"2";"false";"681"
"16417870544782434188";"Impurity seeding with dust injection in tokamak edge plasmas";"2012";"2";"false";"749"
"17375136596487701220";" Measuring the performance of geosimulation models by map comparison";"2008";"2";"false";"114"
"14857446953246869754";" Urban development trend analysis and spatial simulation based on time series remote sensing data: A case study of Jinan, China";"2021";"2";"false";"112"
"11066636266180095757";"Spatial simulation of forest road effects on hydrology and soil erosion after a wildfire";"2021";"2";"false";"190"
"12936778704567948331";"Fast spatial simulation of extreme high-resolution radar precipitation data using INLA";"2023";"2";"false";"351"
"5797596578875249305";" SIGSPATIAL: G: Computational Steering for Geosimulations";"NA";"2";"false";"394"
"5126641381479073640";" Idea generation in group decision-making during school shooting simulations";"2013";"2";"false";"421"
"5500929356234738889";"Complexity theory, spatial simulation models, and land use dynamics in the Northern Ecuadorian Amazon";"2008";"2";"false";"72"
"11150019244986949620";"Spatial Simulation Model of Bauxite Grades Using R Data Analysis: Its Implication for Exploration Activity.";"2022";"2";"false";"23"
"2594505294299641991";" Architectural, urban digital design and spatial simulation tools in digital cities cartography: Contribution in spatial design and perception";"2012";"2";"false";"373"
"3432606349434812278";"Exploring future urban sprawl with the Ocelet Language: A spatial simulation model developed with planners and researchers in Reunion Island";"2013";"2";"false";"420"
"4497683803665738384";" MultiAgent GeoSimulation of human behaviors in micro-scale geographic environments: The case of the shopping behavior in a mall";"2007";"2";"false";"251"
"14776067357081528538";"The case for 3D visualization in DEM assessment";"2012";"2";"false";"307"
"745136990789515774";"Behavioral intelligence for geospatial agents in urban environments";"2007";"2";"false";"665"
"7918060315226561601";"Spatial simulation of soil attribute based on principle of soil science";"2013";"2";"false";"30"
"16857853867086049386";"Evaluation of urban planning strategies with a versatile urban growth model";"2010";"2";"false";"800"
"4253342756568495116";" Our GIS is a Game Engine: Bringing Unity to Spatial Simulation of Rockfalls. GeoComputation 2019";"2019";"2";"false";"158"
"14683343932325783487";" A spatio temporal modelling framework for the integrated assessment of cities";"2012";"2";"false";"625"
"4303835766742987224";"A conceptual framework for the design and evaluation of affective usability in educational geosimulation systems";"2007";"2";"false";"22"
"2589465584087702767";"Exploration of unknown spaces by people who are blind using a multi-sensory virtual environment";"2004";"2";"false";"713"
"822652237537277447";" BFOLDS 1.0: a spatial simulation model for exploring large scale fire regimes and succession in boreal forest landscapes.";"2008";"2";"false";"384"
"10233168862336538208";"High-dimensional spatial simulation ensemble analysis";"2020";"2";"false";"56"
"14701656778773546503";"Improving assessment quality of soil natural attenuation capacity at the point and regional scales";"2023";"2";"false";"153"
"9918005503454197808";"Spatial modeling and simulation of evaluation of the quality of grinding surface of engineering ceramics";"2011";"2";"false";"739"
